{
  "schemaVersion": "0.5.0",
  "profileId": "dofuspourlesnoobs-observed-v1.0.0",
  "purpose": "production",
  "authority": "verified",
  "sourceRuleIds": [
    "R-001",
    "R-002",
    "R-003",
    "R-004",
    "R-005",
    "R-006",
    "R-007",
    "R-008",
    "R-009",
    "R-010",
    "R-011",
    "R-012",
    "R-013",
    "R-014",
    "R-015",
    "R-016",
    "R-017",
    "R-018",
    "R-019",
    "R-020",
    "R-021",
    "R-025",
    "R-026",
    "R-027",
    "R-028",
    "R-029",
    "R-030",
    "R-031",
    "R-032",
    "R-033",
    "R-034",
    "R-035",
    "R-038",
    "R-039",
    "R-040",
    "R-041",
    "R-042",
    "R-043",
    "R-044",
    "R-045",
    "R-046",
    "R-047",
    "R-048",
    "R-049",
    "R-050",
    "R-051",
    "R-053",
    "R-054"
  ],
  "movement": {
    "indecision": {
      "contactMetric": "orthogonal",
      "lineOfSight": "ignored",
      "destinationOccupancy": "invalid"
    },
    "reflection": {
      "targetPillarType": "any_pillar",
      "rangeMetric": "manhattan",
      "minRange": 2,
      "maxRange": 2,
      "alignment": "cardinal_or_diagonal",
      "lineOfSight": "required_clear",
      "pathMode": "fail_if_blocked",
      "destinationOccupancy": "invalid",
      "edgeMode": "invalid"
    },
    "repulsion": {
      "targetPillarType": "any_pillar",
      "rangeMetric": "aligned_steps",
      "minRange": 1,
      "maxRange": 2,
      "allowedAlignments": [
        "cardinal",
        "diagonal"
      ],
      "lineOfSight": "ignored",
      "distance": 3,
      "pathMode": "truncate_before_blocker",
      "destinationOccupancy": "invalid",
      "edgeMode": "truncate_to_last_walkable"
    },
    "attraction": {
      "targetPillarType": "any_pillar",
      "rangeMetric": "aligned_steps",
      "minRange": 1,
      "maxRange": 6,
      "alignment": "cardinal",
      "lineOfSight": "required_clear",
      "distance": 3,
      "pathMode": "fail_if_blocked",
      "destinationOccupancy": "invalid",
      "edgeMode": "invalid",
      "shortRangeBehaviour": "stop_adjacent_to_pillar"
    },
    "pathBlockers": [
      "pillars",
      "permanent_blocked"
    ],
    "lineOfSightBlockers": [
      "pillars",
      "permanent_blocked"
    ]
  },
  "resources": {
    "actionBudgetPerTurn": 12,
    "movementActionCost": 1,
    "trackingMode": "numeric",
    "initialCharges": {
      "indecision": 2,
      "reflection": 2,
      "repulsion": 2,
      "attraction": 2
    },
    "chargeCostPerCast": {
      "indecision": 1,
      "reflection": 1,
      "repulsion": 1,
      "attraction": 1
    },
    "maxCharges": {
      "indecision": 4,
      "reflection": 4,
      "repulsion": 4,
      "attraction": 4
    },
    "rechargePerMatchingPillar": 1,
    "multipleWhiteHitsStack": true,
    "centerWhiteRecharge": "all_spells_plus_one",
    "rechargeTiming": "after_progress_same_turn",
    "rechargeWhenAdverse": "apply"
  },
  "resolution": {
    "blackPriority": true,
    "stationaryReference": "turn_start_cell",
    "stationaryOutcome": "neutral",
    "centerBlackOutcome": "dragon_advance",
    "centerBlackPriority": "same_as_projected_black",
    "noBlackNoWhiteOutcome": "crocoburio_advance",
    "whiteWithoutBlackOutcome": "crocoburio_advance_and_recharge"
  },
  "progress": {
    "dragonTrackLength": 8,
    "crocoburioTrackLength": 14
  }
}
